{
  "version": "1.0.0",
  "generatedAt": "2026-08-29T00:00:00Z",
  "disclaimer": {
    "en": "Reference only; verify with the official gazette/order or your DDO.",
    "hi": "केवल संदर्भ हेतु; आधिकारिक राजपत्र/आदेश अथवा अपने डीडीओ से पुष्टि करें।"
  },
  "portals": [
    {
      "id": "ehrms",
      "name": {
        "en": "Employee Human Resource Management System",
        "hi": "कर्मचारी मानव संसाधन प्रबंधन प्रणाली"
      },
      "shortName": {
        "en": "e-HRMS",
        "hi": "ई-एचआरएमएस"
      },
      "purpose": {
        "en": "Service book, leave, transfer, APAR and the rest of an employee's HR record in one place.",
        "hi": "सेवा पुस्तिका, अवकाश, स्थानांतरण, एपीएआर तथा कर्मचारी का शेष सेवा-अभिलेख एक ही स्थान पर।"
      },
      "url": "https://ehrms.gov.in",
      "category": "hr-service",
      "helpline": null,
      "administeredBy": {
        "en": "Department of Personnel & Training",
        "hi": "कार्मिक एवं प्रशिक्षण विभाग"
      },
      "verify": true
    },
    {
      "id": "sparrow",
      "name": {
        "en": "Smart Performance Appraisal Report Recording Online Window",
        "hi": "स्मार्ट परफॉरमेंस एप्रेज़ल रिपोर्ट रिकॉर्डिंग ऑनलाइन विंडो"
      },
      "shortName": {
        "en": "SPARROW",
        "hi": "स्पैरो"
      },
      "purpose": {
        "en": "Online Annual Performance Appraisal Report (APAR). Run per cadre (SPARROW-IAS, SPARROW-ACC and so on) rather than as one shared site — start from your cadre controlling authority's page.",
        "hi": "ऑनलाइन वार्षिक कार्य निष्पादन मूल्यांकन रिपोर्ट (एपीएआर)। यह एक साझा साइट के बजाय प्रत्येक संवर्ग हेतु अलग से चलाई जाती है (स्पैरो-आईएएस, स्पैरो-एसीसी आदि) — अपने संवर्ग नियंत्रक प्राधिकारी के पृष्ठ से आरंभ करें।"
      },
      "url": "https://dopt.gov.in",
      "category": "hr-service",
      "helpline": null,
      "administeredBy": {
        "en": "Department of Personnel & Training",
        "hi": "कार्मिक एवं प्रशिक्षण विभाग"
      },
      "verify": true
    },
    {
      "id": "cghs",
      "name": {
        "en": "Central Government Health Scheme",
        "hi": "केंद्रीय सरकार स्वास्थ्य योजना"
      },
      "shortName": {
        "en": "CGHS",
        "hi": "सीजीएचएस"
      },
      "purpose": {
        "en": "Wellness centre locator, card status, empanelled hospital list and online claim tracking.",
        "hi": "वेलनेस केंद्र खोजक, कार्ड स्थिति, सूचीबद्ध अस्पतालों की सूची तथा ऑनलाइन दावा अनुरेखण।"
      },
      "url": "https://cghs.gov.in",
      "category": "health",
      "helpline": {
        "phone": "1800-11-4477",
        "label": {
          "en": "CGHS toll-free helpline",
          "hi": "सीजीएचएस टोल-फ्री हेल्पलाइन"
        }
      },
      "administeredBy": {
        "en": "Ministry of Health and Family Welfare",
        "hi": "स्वास्थ्य एवं परिवार कल्याण मंत्रालय"
      },
      "verify": true
    },
    {
      "id": "dopt",
      "name": {
        "en": "Department of Personnel & Training",
        "hi": "कार्मिक एवं प्रशिक्षण विभाग"
      },
      "shortName": {
        "en": "DoPT",
        "hi": "डीओपीटी"
      },
      "purpose": {
        "en": "Conduct, CCA, Leave and recruitment rules; the annual holiday O.M.; establishment circulars.",
        "hi": "आचरण, सीसीए, अवकाश तथा भर्ती नियम; वार्षिक अवकाश कार्यालय ज्ञापन; स्थापना परिपत्र।"
      },
      "url": "https://dopt.gov.in",
      "category": "hr-service",
      "helpline": null,
      "administeredBy": {
        "en": "Ministry of Personnel, Public Grievances and Pensions",
        "hi": "कार्मिक, लोक शिकायत और पेंशन मंत्रालय"
      },
      "verify": true
    },
    {
      "id": "bhavishya",
      "name": {
        "en": "Bhavishya — Pension Sanction and Payment Tracking System",
        "hi": "भविष्य — पेंशन स्वीकृति एवं भुगतान अनुरेखण प्रणाली"
      },
      "shortName": {
        "en": "Bhavishya",
        "hi": "भविष्य"
      },
      "purpose": {
        "en": "End-to-end online tracking of retirement dues, from the pre-retirement checklist to pension sanction, for every retiring Central Government employee.",
        "hi": "सेवानिवृत्त होने वाले प्रत्येक केंद्रीय सरकारी कर्मचारी हेतु सेवानिवृत्ति-पूर्व जाँच-सूची से पेंशन स्वीकृति तक सेवानिवृत्ति देय राशियों का पूर्ण ऑनलाइन अनुरेखण।"
      },
      "url": "https://bhavishya.nic.in",
      "category": "pay-pension",
      "helpline": null,
      "administeredBy": {
        "en": "Department of Pension & Pensioners' Welfare",
        "hi": "पेंशन एवं पेंशनभोगी कल्याण विभाग"
      },
      "verify": true
    },
    {
      "id": "cpengrams",
      "name": {
        "en": "Centralised Pension Grievance Redress and Monitoring System",
        "hi": "केंद्रीकृत पेंशन शिकायत निवारण एवं निगरानी प्रणाली"
      },
      "shortName": {
        "en": "CPENGRAMS",
        "hi": "सीपेनग्राम्स"
      },
      "purpose": {
        "en": "Lodge and track a pension-specific grievance, separately from the general CPGRAMS portal.",
        "hi": "सामान्य सीपीग्राम्स पोर्टल से अलग, पेंशन-विशिष्ट शिकायत दर्ज एवं अनुरेखित करें।"
      },
      "url": "https://cpengrams.nic.in",
      "category": "grievance",
      "helpline": null,
      "administeredBy": {
        "en": "Department of Pension & Pensioners' Welfare",
        "hi": "पेंशन एवं पेंशनभोगी कल्याण विभाग"
      },
      "verify": true
    },
    {
      "id": "cpgrams",
      "name": {
        "en": "Centralized Public Grievance Redress and Monitoring System",
        "hi": "केंद्रीकृत लोक शिकायत निवारण एवं निगरानी प्रणाली"
      },
      "shortName": {
        "en": "CPGRAMS",
        "hi": "सीपीग्राम्स"
      },
      "purpose": {
        "en": "The one portal to lodge a grievance against any Central Government Ministry, Department or office.",
        "hi": "किसी भी केंद्रीय मंत्रालय, विभाग अथवा कार्यालय के विरुद्ध शिकायत दर्ज करने हेतु एकल पोर्टल।"
      },
      "url": "https://pgportal.gov.in",
      "category": "grievance",
      "helpline": null,
      "administeredBy": {
        "en": "Department of Administrative Reforms and Public Grievances",
        "hi": "प्रशासनिक सुधार एवं लोक शिकायत विभाग"
      },
      "verify": true
    },
    {
      "id": "igot-karmayogi",
      "name": {
        "en": "Integrated Government Online Training — Karmayogi",
        "hi": "एकीकृत सरकारी ऑनलाइन प्रशिक्षण — कर्मयोगी"
      },
      "shortName": {
        "en": "iGOT Karmayogi",
        "hi": "आईगॉट कर्मयोगी"
      },
      "purpose": {
        "en": "Anytime-anywhere online learning and course credits for every Central Government employee.",
        "hi": "प्रत्येक केंद्रीय सरकारी कर्मचारी हेतु कभी-भी-कहीं-भी ऑनलाइन शिक्षण एवं पाठ्यक्रम क्रेडिट।"
      },
      "url": "https://igotkarmayogi.gov.in",
      "category": "training",
      "helpline": null,
      "administeredBy": {
        "en": "Capacity Building Commission",
        "hi": "क्षमता निर्माण आयोग"
      },
      "verify": true
    },
    {
      "id": "epfo",
      "name": {
        "en": "Employees' Provident Fund Organisation",
        "hi": "कर्मचारी भविष्य निधि संगठन"
      },
      "shortName": {
        "en": "EPFO",
        "hi": "ईपीएफओ"
      },
      "purpose": {
        "en": "Provident fund passbook, claims and transfer — relevant to a Central Government employee mainly for a spouse or family member covered under EPF rather than under GPF/NPS.",
        "hi": "भविष्य निधि पासबुक, दावे एवं स्थानांतरण — केंद्रीय सरकारी कर्मचारी हेतु यह मुख्यतः जीपीएफ/एनपीएस के बजाय ईपीएफ से आच्छादित जीवनसाथी अथवा परिवार के सदस्य के संदर्भ में प्रासंगिक है।"
      },
      "url": "https://www.epfindia.gov.in",
      "category": "provident-fund-nps",
      "helpline": {
        "phone": "1800-118-005",
        "label": {
          "en": "EPFO toll-free helpline",
          "hi": "ईपीएफओ टोल-फ्री हेल्पलाइन"
        }
      },
      "administeredBy": {
        "en": "Ministry of Labour and Employment",
        "hi": "श्रम एवं रोजगार मंत्रालय"
      },
      "verify": true
    },
    {
      "id": "nps-cra",
      "name": {
        "en": "National Pension System — Central Recordkeeping Agency",
        "hi": "राष्ट्रीय पेंशन प्रणाली — केंद्रीय अभिलेख रखरखाव एजेंसी"
      },
      "shortName": {
        "en": "NPS / CRA",
        "hi": "एनपीएस / सीआरए"
      },
      "purpose": {
        "en": "PRAN account statement, scheme and fund manager choice, and NPS withdrawal.",
        "hi": "पीआरएएन खाता विवरण, योजना एवं निधि प्रबंधक चयन, तथा एनपीएस आहरण।"
      },
      "url": "https://npscra.nsdl.co.in",
      "category": "provident-fund-nps",
      "helpline": null,
      "administeredBy": {
        "en": "Pension Fund Regulatory and Development Authority",
        "hi": "पेंशन निधि विनियामक एवं विकास प्राधिकरण"
      },
      "verify": true
    },
    {
      "id": "ups",
      "name": {
        "en": "Unified Pension Scheme",
        "hi": "एकीकृत पेंशन योजना"
      },
      "shortName": {
        "en": "UPS",
        "hi": "यूपीएस"
      },
      "purpose": {
        "en": "Information and the one-time option form for the assured-payout alternative within NPS. See data/pay/ups.json for the contribution and payout figures.",
        "hi": "एनपीएस के भीतर सुनिश्चित-भुगतान विकल्प हेतु जानकारी तथा एक-बारगी विकल्प फॉर्म। अंशदान एवं भुगतान आँकड़ों हेतु data/pay/ups.json देखें।"
      },
      "url": "https://doppw.gov.in",
      "category": "provident-fund-nps",
      "helpline": null,
      "administeredBy": {
        "en": "Department of Pension & Pensioners' Welfare",
        "hi": "पेंशन एवं पेंशनभोगी कल्याण विभाग"
      },
      "verify": true
    },
    {
      "id": "gem",
      "name": {
        "en": "Government e-Marketplace",
        "hi": "सरकारी ई-मार्केटप्लेस"
      },
      "shortName": {
        "en": "GeM",
        "hi": "जेम"
      },
      "purpose": {
        "en": "The mandatory online marketplace for a government office's own procurement (GFR 2017).",
        "hi": "सरकारी कार्यालय की स्वयं की खरीद हेतु अनिवार्य ऑनलाइन मार्केटप्लेस (सामान्य वित्तीय नियम 2017)।"